orgid,orgname,industry,asset_type,min,max,hidemax,type,lobbies,contributes
"",Federal Thrift Savings Plan,Unknown,"Brokerage, IRA, 401k",100001,250000,0,Y,,
"",Employees Retirement System of Texas,Unknown,"Brokerage, IRA, 401k",50001,100000,0,Y,,
"",TX County-District Retiremt System,Unknown,"Brokerage, IRA, 401k",15001,50000,0,Y,,
"",Phoenix Life Insurance Whole Life,Unknown,Insurance policies & Annuities,15001,50000,0,Y,,
"",Congressional FCU/Savings,Unknown,Cash/Money Market/Savings/Checking,15001,50000,0,Y,,
