orgid,orgname,industry,asset_type,min,max,hidemax,type,lobbies,contributes
"",Mutual of Omaha Toolbox,Unknown,Mutual Fund,265002,550000,0,Y,,
"",Specialized Medical Operations Inc,Misc Health,,50001,100000,0,Y,,
"",USAA College Savings Plan Balanced Portf,Unknown,Mutual Fund,15001,50000,0,Y,,
"",Knights of Columbus Whole Life Insurance,Unknown,Insurance policies & Annuities,15001,50000,0,Y,,
"",Inland Western REIT,Real Estate,,15001,50000,0,Y,,
"",Bank of America Account,Commercial Banks,Cash/Money Market/Savings/Checking,15001,50000,0,Y,,
"",USAA Precious Metals Fund,Mining,,1001,15000,0,Y,,
"",USAA International Fund,Unknown,Mutual Fund,1001,15000,0,Y,,
"",USAA Growth & Tax Fund,Unknown,Mutual Fund,1001,15000,0,Y,,
