orgid,orgname,industry,asset_type,min,max,hidemax,type,lobbies,contributes
"",Tweedy Browne Global Fund,Unknown,Mutual Fund,50001,100000,0,T,,
"",Tweedy Browne Value Fund,Unknown,Mutual Fund,15001,50000,0,T,,
"",ND Teachers Fund for Retirement,Unknown,Mutual Fund,15001,50000,0,T,,
"",Fidelity Spartan US Equity Index,Unknown,Mutual Fund,15001,50000,0,T,,
"",Fidelity Diversified,Unknown,Mutual Fund,15001,50000,0,T,,
"",Fidelity Blue Chip Fund,Unknown,Mutual Fund,15001,50000,0,T,,
"",Allianz NFJ Small Fund,Unknown,Mutual Fund,15001,50000,0,T,,
"",SunAmerica Mutual Funds Focused Lg-Cap,Unknown,,2002,30000,0,T,,
"",Lincoln Financial Gap,Unknown,,1001,15000,0,T,,
