orgid,orgname,industry,asset_type,min,max,hidemax,type,lobbies,contributes
"",US Treasury Bond,Unknown,Government Bond,250005,500000,0,T,,
"",SunTrust Bank/CD,Unknown,Cash/Money Market/Savings/Checking,250001,500000,0,T,,
"",Streettracks Gold Trust ETF,Mining,Mutual Fund,250001,500000,0,T,,
"",Florida Real Estate,Real Estate,,250001,500000,0,T,,
"","Eau Claire, WI G/O Bonds",Unknown,Government Bond,200002,500000,0,T,,
"","Milwaukee, WI Redev Auth Bond",Unknown,Government Bond,150002,350000,0,T,,
"",Financing Corp Cpn Strips,Unknown,,115002,300000,0,T,,
"",Wisconsin St Bonds,Unknown,Government Bond,100001,250000,0,T,,
"",Wisconsin Health & Educ Facs Bond,Unknown,Government Bond,100001,250000,0,T,,
"","Will County, IL School District Bond",Unknown,Government Bond,100001,250000,0,T,,
"",Will & Kendall Counties G/O Bond,Unknown,Government Bond,100001,250000,0,T,,
"","Waterville, MN G/O Bond",Unknown,Government Bond,100001,250000,0,T,,
"","Valparaiso, IN Sewer Rev Bond",Unknown,Government Bond,100001,250000,0,T,,
"",Tri-Creek 2002 High Bond,Unknown,Government Bond,100001,250000,0,T,,
"","St Paul, MN Cap Improvement G/O Bond",Unknown,Government Bond,100001,250000,0,T,,
"",Southeast Wisconsin Pro Baseball Pk Bond,Unknown,Government Bond,100001,250000,0,T,,
"","Racine, Wis Waterworks Rev Wtr",Unknown,Government Bond,100001,250000,0,T,,
"",Pine Grove PA Area Sch Dist GO School Bd,Unknown,Government Bond,100001,250000,0,T,,
"","Osakis, MN Isd 213 G/O Bonds",Unknown,Government Bond,100001,250000,0,T,,
"","Orono, MN Hsg & Redev Bond",Unknown,Government Bond,100001,250000,0,T,,
"",Oregon WI School District G/O Bond,Unknown,Government Bond,100001,250000,0,T,,
"","Olmsted County, MN G/O Bond",Unknown,Government Bond,100001,250000,0,T,,
"",Olathe Kans Ser 215 G/O bond,Unknown,Government Bond,100001,250000,0,T,,
"","Novi, MI Cmnty School G/O Bond",Unknown,Government Bond,100001,250000,0,T,,
"",North Dakota Bldg Bond,Unknown,Government Bond,100001,250000,0,T,,
"",New Richmond WI School District G/O Bond,Unknown,Government Bond,100001,250000,0,T,,
"",Mukwonago WI G/O Bond,Unknown,Government Bond,100001,250000,0,T,,
"","Milwaukee County, WI Bond",Unknown,Government Bond,100001,250000,0,T,,
"","Menomonee Falls, WI G/O Bond",Unknown,Government Bond,100001,250000,0,T,,
"",McHenry Cnty IL Cmnty G/O HSD Apprec Bnd,Unknown,Government Bond,100001,250000,0,T,,
"","Marysville, OH Wastewater Bond",Unknown,Government Bond,100001,250000,0,T,,
"","Maple Grove, MN G/O Bond",Unknown,Government Bond,100001,250000,0,T,,
"","Mankato, MN G/O Bond",Unknown,Government Bond,100001,250000,0,T,,
"",Madison-Water Util Rev Bond,Unknown,Government Bond,100001,250000,0,T,,
"","Madison, WI Met Sch G/O Bond",Unknown,Government Bond,100001,250000,0,T,,
"","Lawrenceburg, IN School Building Bond",Unknown,Government Bond,100001,250000,0,T,,
"","Lake County, IN Pk Dist Bond",Unknown,Government Bond,100001,250000,0,T,,
"","Kenosha County, WI G/O Bonds",Unknown,Government Bond,100001,250000,0,T,,
"",Hanover Multi School Bond,Unknown,Government Bond,100001,250000,0,T,,
"","Greenwood, In Sch Bldg Bond",Unknown,Government Bond,100001,250000,0,T,,
"","Greensburg, IN Sch Bldg Bond",Unknown,Government Bond,100001,250000,0,T,,
"","Green Bay, WI Met Sewer Dist G/O Bond",Unknown,Government Bond,100001,250000,0,T,,
"","Green Bay, WI G/O Corp Purp Bonds",Unknown,Government Bond,100001,250000,0,T,,
"",Greater Clark Cnty Sch Bldg Corp Ind Jef,Unknown,Government Bond,100001,250000,0,T,,
"","Fridley, MN SD 014 G/O Bond",Unknown,Government Bond,100001,250000,0,T,,
"","Freeborn County, MN G/O Bonds",Unknown,Government Bond,100001,250000,0,T,,
"","Farmington, MN Isd G/O Bonds",Unknown,Government Bond,100001,250000,0,T,,
"",Evansville-Vandrburgh G/O Bonds,Unknown,Government Bond,100001,250000,0,T,,
"","Evanston, IL G/O Bonds",Unknown,Government Bond,100001,250000,0,T,,
"","Chicago, IL Brd Ed G/O Bonds",Unknown,Government Bond,100001,250000,0,T,,
"",Cash & Money Market Fund Balances,Unknown,Cash/Money Market/Savings/Checking,100001,250000,0,T,,
"","Bolingbrook, IL G/O ref Bonds",Unknown,Government Bond,100001,250000,0,T,,
"","Anderson, IN Sew Wks Rev Bonds",Unknown,Government Bond,100001,250000,0,T,,
"",Allen Park MI Pub SD G/O Bonds,Unknown,Government Bond,100001,250000,0,T,,
"","Akron, OH G/O Bonds",Unknown,Government Bond,100001,250000,0,T,,
"",Wisconsin St Health & Edl Facs,Unknown,Government Bond,50001,100000,0,T,,
"",Wisconsin G/O Bonds,Unknown,Government Bond,50001,100000,0,T,,
"","Warsaw, IN Multi-Sch Bldg Bond",Unknown,Government Bond,50001,100000,0,T,,
"","St Joseph County, IN Econ Bond",Unknown,Government Bond,50001,100000,0,T,,
"","St Francis, MN Isd G/O Bond",Unknown,Government Bond,50001,100000,0,T,,
"",Series HH/H US Savings Bonds,Unknown,Cash/Money Market/Savings/Checking,50001,100000,0,T,,
"",Puerto Rico Indl Med Rv Bond,Unknown,Government Bond,50001,100000,0,T,,
"",Oak Creek Wis Ref G/O Bonds 2010,Unknown,Government Bond,50001,100000,0,T,,
"","Milwaukee County, WI Arpt Rev Bond",Unknown,Government Bond,50001,100000,0,T,,
"","Marion County, IN Convtn Bond",Unknown,Government Bond,50001,100000,0,T,,
"","Mandan, ND G/O Bond",Unknown,Government Bond,50001,100000,0,T,,
"",JPMorgan Chase Bank Accounts,Unknown,Cash/Money Market/Savings/Checking,50001,100000,0,T,,
"",Illinois St G/O Bonds,Unknown,Government Bond,50001,100000,0,T,,
"",Guam Power Auth Rev Bonds,Unknown,Government Bond,50001,100000,0,T,,
"","Grafton, WI Corp RFDG Purp Bond",Unknown,Government Bond,50001,100000,0,T,,
"",Fond Du Lac WI G/O FGIC Prom nts Bond,Unknown,Government Bond,50001,100000,0,T,,
"",Cook & Du Page Counties Bond,Unknown,Government Bond,50001,100000,0,T,,
"","Chicago, IL Brd Ed Cap Bonds",Unknown,Government Bond,50001,100000,0,T,,
"",Chicago Ill G/O Bonds 2006A,Unknown,Government Bond,50001,100000,0,T,,
"","Bolingbrook, IL Spl Service Bonds",Unknown,Government Bond,50001,100000,0,T,,
"",Appleton Wis Storm Water Sys,Unknown,Government Bond,50001,100000,0,T,,
"",Appleton WI Area Sch Dist Ref G/O Bonds,Unknown,Government Bond,50001,100000,0,T,,
"",Lake Cnty Il Cmnty G/O FGIC Cap App HSD,Unknown,Government Bond,15001,50000,0,T,,
D000000125,General Electric,Misc Mfg/Distrib,,15001,50000,0,T,Y,Y
"",Dane County Wis G/O Ref Bonds 2010,Unknown,Government Bond,15001,50000,0,T,,
D000021800,3M Co,Misc Mfg/Distrib,,15001,50000,0,T,Y,
D000000485,Procter & Gamble,Misc Mfg/Distrib,,1001,15000,0,T,Y,
D000000115,Microsoft Corp,Electronics Mfg/Eqp,,1001,15000,0,T,Y,Y
D000000419,Home Depot,Retail Sales,,1001,15000,0,T,Y,
"",Dell Inc,Electronics Mfg/Eqp,,1001,15000,0,T,,
D000000374,Cisco Systems,Electronics Mfg/Eqp,,1001,15000,0,T,Y,
"",Bank of America Account,Commercial Banks,Cash/Money Market/Savings/Checking,1001,15000,0,T,,
"",Ginnie Mae Securities,Real Estate,,1,1000,0,T,,
