orgid,orgname,industry,asset_type,min,max,hidemax,type,lobbies,contributes
"",Condo Bonita Springs,,,250001,500000,0,Y,,
"",SEP IRA Value Advantage,,"Brokerage, IRA, 401k",100001,250000,0,Y,,
"",Emily Forest Products,Unknown,,100001,250000,0,Y,,
"",Vacation Home - Nissawa,,,50001,100000,0,Y,,
"",American Funds Europacifc Growth,,Mutual Fund,15001,50000,0,Y,,
"",Schwab IRA Value Advantage,,"Brokerage, IRA, 401k",1001,15000,0,Y,,
"",Riverwood Bank Money Market,,Cash/Money Market/Savings/Checking,1001,15000,0,Y,,
"",IRA Roth Money Market,,"Brokerage, IRA, 401k",1001,15000,0,Y,,
