orgid,orgname,industry,asset_type,min,max,hidemax,type,lobbies,contributes
"",Goldman Sachs Tax-Advantaged Global Equity Fund,,Mutual Fund,10000002,50000000,0,Y,,
"",Trott Northwestern LLC,Real Estate,,5001002,25015000,0,Y,,
"",ATI Holdings,,Note/Note Receivable,5000002,25001000,0,Y,,
"",David A Trott 2010 Irrevocable Granto,,"Brokerage, IRA, 401k",3000003,15000000,0,Y,,
"",Goldman Sachs Bank Deposit,,Cash/Money Market/Savings/Checking,2415016,10977000,0,Y,,
D000000085,Goldman Sachs,Securities/Invest,,1503005,6045000,0,Y,Y,Y
"",Trott-ATA LLC,Unknown,,1000002,5001000,0,Y,,
"",Talon Title Agency,Real Estate,,1000001,5000000,0,Y,,
"",Portage Mich Pub Schs G/O Bond,,Government Bond,1000001,5000000,0,Y,,
"",NetDirector LLC,,,1000001,5000000,0,Y,,
"","Loan to Trott Properties 294, LLC, Farmington Hill",,,1000001,5000000,0,Y,,
"",iShares US Financial Services ETF,Securities/Invest,,1000001,5000000,0,Y,,
"",Installment Receivable - Trott Law,,Note/Note Receivable,1000001,5000000,0,Y,,
"",Hedge Fund Opportunities,,Mutual Fund,1000001,5000000,0,Y,,
"",Goldman Sachs Tax-Advantaged Global Equity,,Mutual Fund,1000001,5000000,0,Y,,
"",District Columbia Water & Sewer Revenue Bond,,Government Bond,1000001,5000000,0,Y,,
"",Commonwealth of Puerto Rico G/O Bond,,Government Bond,1000001,5000000,0,Y,,
"",Artisan Dynamic Equity Fund,,Mutual Fund,1000001,5000000,0,Y,,
"",Michigan State Trunk Line Rev Bond,,Government Bond,1015003,2050000,0,Y,,
"",Trott Family Investment,Securities/Invest,,1000002,2000000,0,Y,,
"",Waterford Mich School District GO Bond,,Government Bond,750002,1500000,0,Y,,
"",MARYSVILLE MICH PUB SCHS DIST GO,,Government Bond,750002,1500000,0,Y,,
"",Hawaii State General Obligation BOND,,Government Bond,750002,1500000,0,Y,,
"",Energy Northwest Revenue Bond,,Government Bond,750002,1500000,0,Y,,
"","Quincy, Michigan Community Schools Bond",,Government Bond,600002,1250000,0,Y,,
"",NUVEEN SYMPHONY FLOATING RATE INCOME FUND,,Mutual Fund,600002,1250000,0,Y,,
"","Dearborn, MI School District Bond",,Government Bond,600002,1250000,0,Y,,
D000032012,BNP Paribas,,,600003,1250000,0,Y,,
"",Goldman Sachs Strategic Income Fund,,Mutual Fund,565004,1150000,0,Y,,
"",Pimco Income Fund,,Mutual Fund,550003,1100000,0,Y,,
"",Zeeland Mich Pub Schs GO Bond,,Government Bond,500001,1000000,0,Y,,
"",WOODHAVEN BROWNSTOWN MICH SCH GO,,Government Bond,500001,1000000,0,Y,,
"",Warren Mich Cons School District Bond,,Government Bond,500001,1000000,0,Y,,
"",Victura LLC,Unknown,,500001,1000000,0,Y,,
"",University Mich Univ Revs Revenue Bond,,Government Bond,500002,1000000,0,Y,,
"",UBS AG Linked to S&P 500 Index Buffered Capped Bet,,Mutual Fund,500002,1000000,0,Y,,
"",Trott Properties 294 LLC,Real Estate,,500002,1000000,0,Y,,
"",Toucan Family LLC,Misc Finance,,500001,1000000,0,Y,,
"",Thurston Cnty Wash Sch Dist No G/O Bond,,Government Bond,500001,1000000,0,Y,,
"",Royal Bank of Canada Linked to S&P 500 Index Buffe,,Mutual Fund,500002,1000000,0,Y,,
"",Plymouth-Canton Mich Cmnty Sch G/O Bond,,Government Bond,500001,1000000,0,Y,,
"",New Jersey Transportation Trst Revenue Bond,,Government Bond,500001,1000000,0,Y,,
"",Michigan Comprehensive Revenue Bond,,Government Bond,500001,1000000,0,Y,,
"","Klein, TX Independent School District Bond",,Government Bond,500001,1000000,0,Y,,
"",interest in Air Trott LLC/FRACTIONAL AIRCRAFT SHAR,Air Transport,,500001,1000000,0,Y,,
"","Installment Receivable - Jeffrey Weisserman, Farmi",,,500001,1000000,0,Y,,
"","Installment Receivable - Jeffrey Raff, Clarkston",,"""Account"" or Combination of other types (I.e.Stocks & Bonds)",500001,1000000,0,Y,,
"","Installment Receivable - CBWM LLC, Detroit, MI",,"""Account"" or Combination of other types (I.e.Stocks & Bonds)",500001,1000000,0,Y,,
"","Holly, MI Area School District",,Government Bond,500001,1000000,0,Y,,
"",Hedge Fund Managers LLC,,Mutual Fund,500001,1000000,0,Y,,
"",Grand Rapids Mich Cmnty GO MN College Bond,,Government Bond,500001,1000000,0,Y,,
"","Grand Blanc, MI Community Schools Bond",,Government Bond,500001,1000000,0,Y,,
"",Goldman Sachs Enhanced Dividend Global Equity,,Mutual Fund,500001,1000000,0,Y,,
"",Forest Hills Mich Pub Schs GO Bond,,Government Bond,500001,1000000,0,Y,,
"","Farmington, MI Public School District GO Bond",,Government Bond,500002,1000000,0,Y,,
"",Drinking Water State Revolving Fund,,Government Bond,500001,1000000,0,Y,,
D000059147,Detroit Legal News Publishing,Unknown,,500001,1000000,0,Y,,
"",City of Phoenix CVC Impvmt Crp Rev,,Government Bond,500002,1000000,0,Y,,
"","Caledonia, MI Community Schools GO Bond",,Government Bond,500001,1000000,0,Y,,
D000000103,JPMorgan Chase & Co,Commercial Banks,,400003,850000,0,Y,Y,Y
"",Anchor Bay Mich School District GO Bond,,Government Bond,350002,750000,0,Y,,
"",US Dollar,,Cash/Money Market/Savings/Checking,232012,636000,0,Y,,
D000019743,Wells Fargo,Commercial Banks,,300002,600000,0,Y,Y,Y
"",WHITMORE LAKE MICH PUB SCH GO,,Government Bond,250001,500000,0,Y,,
"",Virtus Emerging Markets Opportunities Fund,,Mutual Fund,250001,500000,0,Y,,
"",Vanguard FTSE Emerging Markets Fund,,Mutual Fund,250001,500000,0,Y,,
"",Troy Mich City School District GO Bond,,Government Bond,250001,500000,0,Y,,
"",Sun Life Assurance Co of Canada,,Insurance policies & Annuities,250001,500000,0,Y,,
"","Sturgis, MI Public School District Bond",,Government Bond,250001,500000,0,Y,,
"",STATE OF WASHINGTON DB Bonds,,Government Bond,250001,500000,0,Y,,
"",SPDR MidCap 400 ETF,,Mutual Fund,250001,500000,0,Y,,
D000037654,Societe Generale,Commercial Banks,,200002,500000,0,Y,,
"",Sharing Plan & Trust,,Mutual Fund,250001,500000,0,Y,,
"",Puerto Rico Bond,,Government Bond,200002,500000,0,Y,,
"",PROGRESS RESIDENTIAL ACCESS LP,Unknown,,250001,500000,0,Y,,
"",PORTLAND MICH PUB SCHS GO,,Government Bond,250001,500000,0,Y,,
"",PLYMOUTH-CANTON MICH CMNTY SCH GO Bond,,Government Bond,200002,500000,0,Y,,
"",Palm Beach Florida-County of Rev Bond,,Government Bond,250001,500000,0,Y,,
"",Ohio Water Development Auth Rev Bonds,,Government Bond,250001,500000,0,Y,,
"",OHIO STATE WATER DEV AUTH REV,,Government Bond,250001,500000,0,Y,,
"","Novi, MI Community School District Bond",,Government Bond,250001,500000,0,Y,,
"",Michigan Trunk Line Revenue Bond,,Government Bond,250001,500000,0,Y,,
"",Michigan Truckline Fund Bond,,Government Bond,250001,500000,0,Y,,
"",Michigan Financial Authority Rev Bonds,,Government Bond,200002,500000,0,Y,,
"",Michigan Finance Authority Revenue Bond,,Government Bond,250001,500000,0,Y,,
"","Manatee County, FL Rev Bond",,Government Bond,250001,500000,0,Y,,
D000027337,Magellan Midstream Partners,Oil & Gas,,250001,500000,0,Y,Y,
"",MACOMB INTERCEPTOR DRAIN DB,,Government Bond,250001,500000,0,Y,,
"","Lincoln, MI Cons School District Bond",,Government Bond,250001,500000,0,Y,,
"",JANA PARTNERS QUALIFIED,,Mutual Fund,250001,500000,0,Y,,
"",Goldman Sachs Multi-Manager Alternatives I Fund,,Mutual Fund,250001,500000,0,Y,,
"",Goldman Sachs Financial Square Tax-Free MM Fund,,Mutual Fund,250001,500000,0,Y,,
"",Global Atlantic Financial,Insurance,Insurance policies & Annuities,250001,500000,0,Y,,
"",ESG Domestix Opportunity Fund,,Mutual Fund,250001,500000,0,Y,,
D000033463,Enterprise Products Partners,Oil & Gas,Mutual Fund,250001,500000,0,Y,Y,
"",Credit Suisse AG Linked to S&P 500 Index Buffered,,Mutual Fund,250001,500000,0,Y,,
"",Comerica Bank Accounts,,Cash/Money Market/Savings/Checking,250001,500000,0,Y,,
"",CLARK County NEV REV Bonds,,Government Bond,250001,500000,0,Y,,
"","Central Bucks, PA School District Bond",,Government Bond,250001,500000,0,Y,,
"",Brevan Howard Multi-Strategy Fund,,Mutual Fund,250001,500000,0,Y,,
"","Brandon, MI School District Bond",,Government Bond,250001,500000,0,Y,,
"","Battle Creek, MI GO Bond",,Government Bond,250001,500000,0,Y,,
D000043256,Barclays Bank,Commercial Banks,,200002,500000,0,Y,,
"","Ann Arbor, MI School District Bond",,Government Bond,250001,500000,0,Y,,
"",Adelphi Europe Partners,,Mutual Fund,250001,500000,0,Y,,
"",T Rowe Price Funds T Rowe Price High Yield Fund,,Mutual Fund,150002,350000,0,Y,,
"",Deutsche Bank,,,150002,350000,0,Y,,
"",Williams Partners,Oil & Gas,,100001,250000,0,Y,,
"",WHITEHALL MICH DIST SCHS GO,,Government Bond,100001,250000,0,Y,,
"",Western Gas Partners,Oil & Gas,,100001,250000,0,Y,,
"","Troy, MI City School District Bond",,Government Bond,100001,250000,0,Y,,
"",Trott Northwestern,Unknown,,100001,250000,0,Y,,
"",Transamerica Life Insurance Co,,Insurance policies & Annuities,100001,250000,0,Y,,
"",THORNAPPLE KELLOGG MICH SCH GO Bonds,,Government Bond,100001,250000,0,Y,,
"",Tesoro Logistics,Oil & Gas,,100001,250000,0,Y,,
"",Sunoco Logistics Partners,Oil & Gas,,100001,250000,0,Y,,
"",South Carolina Pub Svce Auth Revenue Bond,,Government Bond,100001,250000,0,Y,,
D000022636,Royal Bank of Canada,,,100001,250000,0,Y,Y,
"",ROSEVILLE MICH CMNTY SCHS GO,,Government Bond,100001,250000,0,Y,,
"",ROCHESTER MICH CMNTY SCH DIST GO BONDS,,Government Bond,100001,250000,0,Y,,
D000059511,Plains All American Pipeline,Oil & Gas,,100001,250000,0,Y,Y,
"",Ohio University Gen Rcpts Athens Revenue Bond,,Government Bond,100001,250000,0,Y,,
"",NY NY CITY HEALTH & HOSP CORP,,Government Bond,100001,250000,0,Y,,
"",NORTHVILLE MICH PUB SCHS GO BONDS,,Government Bond,100001,250000,0,Y,,
"",Northern Ariz University Revenue Bond,,Government Bond,100001,250000,0,Y,,
"",NEW YORK CITY NY REV Bond,,Government Bond,100001,250000,0,Y,,
"",New Jersey Economic Dev Auth Revenue Bond,,Government Bond,100001,250000,0,Y,,
"",Municipal Elctrc Auth of GA Revenue Bond,,Government Bond,100001,250000,0,Y,,
"",Missouri State Env Impt & Energy Res AU Rev Bond,,Government Bond,100001,250000,0,Y,,
"",Michigan State University Bonds,,Government Bond,100001,250000,0,Y,,
"",Massachusetts Mun Whsl Elec Co Revenue Bond,,Government Bond,100001,250000,0,Y,,
"",MAPLE VALLEY MICH SCHS GO Bonds,,Government Bond,100001,250000,0,Y,,
"",MANSFIELD INDPT SCHOOL DIST GO Bonds,,Government Bond,100001,250000,0,Y,,
"",Mailverse LLC,Unknown,,100001,250000,0,Y,,
"","Loan to Marcy J. Ford, Huntington Woods, MI",,"""Account"" or Combination of other types (I.e.Stocks & Bonds)",100001,250000,0,Y,,
"","Linden, MI Community School District Bond",,Government Bond,100001,250000,0,Y,,
"",Legal Press LLC,Unknown,,100001,250000,0,Y,,
"",Killeen Independent School District G/O Bond,,Government Bond,100001,250000,0,Y,,
"",Kentucky Property & Building Revenue Bond,,Government Bond,100001,250000,0,Y,,
"",JACKSONVILLE FLA SALES TAX REV Bond,,Government Bond,100001,250000,0,Y,,
"",ISHARES RUSSELL 2000 ETF,,Mutual Fund,100001,250000,0,Y,,
"",Illinois State Toll Highway Auth Rev Bonds,,Government Bond,100001,250000,0,Y,,
"",HARVEY County KANS UNI SCH DIST GO Bond,,Government Bond,100001,250000,0,Y,,
"",Grand River Floodwalls REV Bond,,Government Bond,100001,250000,0,Y,,
"",Goldman Sachs & Co Brokerage Account,,"Brokerage, IRA, 401k",100001,250000,0,Y,,
"",Glostream Inc,,,100001,250000,0,Y,,
"",GEORGIA STATE GENL OBLIGATION GO Bonds,,Government Bond,100001,250000,0,Y,,
"","Fenton, MI AREA PUB SCHS GO Bonds",,Government Bond,100001,250000,0,Y,,
"","Essexville-Hampton, M Public GO Bond",,Government Bond,100001,250000,0,Y,,
D000025688,Energy Transfer Equity,Oil & Gas,,100001,250000,0,Y,Y,
"",Credit Suisse,,,100001,250000,0,Y,,
"",CLEVELAND OHIO INCOME TAX REV Bonds,,Government Bond,100001,250000,0,Y,,
"",City of Philadelphia GO Bond,,Government Bond,100001,250000,0,Y,,
"","Chicago, IL Transit Auth CAP GRNT REV Bond",,Government Bond,100001,250000,0,Y,,
"",Buckeye Partners,Oil & Gas,,100001,250000,0,Y,,
"","Belding, MI Area Schools GO Bond",,Government Bond,100001,250000,0,Y,,
"",Bank of America Private Wealth Management,,"Brokerage, IRA, 401k",100001,250000,0,Y,,
"","Atlanta, GA Airport Passenger Fac Bond",,Government Bond,100001,250000,0,Y,,
"",ARMA Acquisition LLC,Unknown,,100001,250000,0,Y,,
"",Michigan State Trunk Line Rev Bonds,,Government Bond,100002,200000,0,Y,,
"",WATERFORD MICHIGAN SCHOOL DIST GO BONDS,,Government Bond,50001,100000,0,Y,,
"",Washington State Motor Vehicle Fuel Bond,,Government Bond,50001,100000,0,Y,,
D000022303,Valero Energy,Oil & Gas,,50001,100000,0,Y,Y,
"",University Mich Univ Revs Rev Bonds,,Government Bond,50001,100000,0,Y,,
"",Trott Management,Unknown,,50001,100000,0,Y,,
"",Targa Resources Partners,Oil & Gas,,50001,100000,0,Y,,
"",ROUND ROCK TEX INDPT SCH DIST ULTD TAX REF BONDS,,Government Bond,50001,100000,0,Y,,
"",RILEY CNTY KANS UNI SCH DIST N GO REF BONDS,,Government Bond,50001,100000,0,Y,,
"",Rice Midstream Partners,Oil & Gas,,50001,100000,0,Y,,
"",Puerto Rico Sales Tax Fing Rev Bonds,,Government Bond,50001,100000,0,Y,,
"",PORTAGE MICH PUB SCHS GO Bonds,,Government Bond,50001,100000,0,Y,,
"",Phillips 66 Partners LP,Unknown,,50001,100000,0,Y,,
D000028149,Oneok Inc,Oil & Gas,,50001,100000,0,Y,Y,
"",New York State Twy Auth Rev Bond,,Government Bond,50001,100000,0,Y,,
"",Michigan State COMPREHENSIVE TRANSN REV Bonds,,Government Bond,50001,100000,0,Y,,
"",Metropolitan Transn Auth N Y R Transportation Rev,,Government Bond,50001,100000,0,Y,,
"",Mesa Ariz G/O Ref Bonds,,Government Bond,50001,100000,0,Y,,
"","Kent County, Michigan GO Bonds",,Government Bond,50001,100000,0,Y,,
"","Kalamazoo, MI GO Bonds",,Government Bond,50001,100000,0,Y,,
"","Kalamazoo, MI GO Bond",,Government Bond,50001,100000,0,Y,,
"",Johnson Cnty Kans Pub Bldg Com Rev Bond,,Government Bond,50001,100000,0,Y,,
"","Jefferson County, KY SCH DIST FIN BLDG REV Bonds",,Government Bond,50001,100000,0,Y,,
"",JEFFERSON CNTY KY SCH DIST FIN REV Bond,,Government Bond,50001,100000,0,Y,,
"",JACKSONVILLE FLA TRANS REV REV Bond,,Government Bond,50001,100000,0,Y,,
"","Grosse, MI ILL TWP School District Bond",,Government Bond,50001,100000,0,Y,,
"",Goldman Sachs Enhanced Dividend Global Equity Port,,Mutual Fund,30002,100000,0,Y,,
"",Goldman Sachs Enchanced Dividend Global Equity,,Mutual Fund,30002,100000,0,Y,,
"",Genesis Energy LP,Misc Energy,,50001,100000,0,Y,,
"","Fulton County, GA Dev AUTH REV REF REV Bonds",,Cash/Money Market/Savings/Checking,50001,100000,0,Y,,
"",Collin County TX Ult Tax Rd Bonds,,Government Bond,50001,100000,0,Y,,
"","Clark County, NV School District Bond",,Government Bond,50001,100000,0,Y,,
"",Bernalillo County Water & Sewer System Bond,,Cash/Money Market/Savings/Checking,50001,100000,0,Y,,
"",Antero Midstream Partners,Oil & Gas,,50001,100000,0,Y,,
"",Ann Arbor MI School District Pub Go Bonds,,Government Bond,50001,100000,0,Y,,
"",ANKENY IOWA REF-SER A GO BONDS,,Cash/Money Market/Savings/Checking,50001,100000,0,Y,,
"",WAYNE-WESTLAND CMNTY SCHS MICH GO Bonds,,Government Bond,15001,50000,0,Y,,
"",Troy Mich GO Bonds,,Government Bond,15001,50000,0,Y,,
"",STATE OF HAWAII GO BONDS,,Government Bond,15001,50000,0,Y,,
"","Royal Oak, MI Hospitality Financial Auth Rev Bonds",,Government Bond,15001,50000,0,Y,,
"",Rockford Mich Pub Schs Go Bond,,Government Bond,15001,50000,0,Y,,
"",Rhode Island State & Providence GO Bonds,,Government Bond,15001,50000,0,Y,,
"",Puerto Rico GO Bond,,Government Bond,15001,50000,0,Y,,
"",Ohio State University Gen Rcpts Revenue Bond,,Government Bond,15001,50000,0,Y,,
"",New Jersey Economic Auth Rev Bonds,,Government Bond,15001,50000,0,Y,,
D000023121,MPLX LP,Oil & Gas,,15001,50000,0,Y,Y,
"",MICHIGAN State GO Bonds,,Government Bond,15001,50000,0,Y,,
"",Michigan Fin Auth Rev Rev Bonds,,Government Bond,15001,50000,0,Y,,
"","Loan to Velox Disposal, Inc., Bloomfield Hills, MI",,"""Account"" or Combination of other types (I.e.Stocks & Bonds)",15001,50000,0,Y,,
"",Loan to Talon Title Agency,,"""Account"" or Combination of other types (I.e.Stocks & Bonds)",15001,50000,0,Y,,
"","Installment Receivable - Jimax, LLC, Farmington Hi",,,15001,50000,0,Y,,
"","Installment Receivable - Dietz Trott, LLC, Farming",,,15001,50000,0,Y,,
"",FEDERATED TAX FREE OBLIGATIONS FUND,,Mutual Fund,15001,50000,0,Y,,
"",EQT Midstream Partners,Oil & Gas,,15001,50000,0,Y,,
"",EQT GP Holdings,Unknown,,15001,50000,0,Y,,
"",DCP Midstream Partners,Oil & Gas,,15001,50000,0,Y,,
"","Brevard County, FL School Board CTFS Cops Bonds",,Government Bond,15001,50000,0,Y,,
"","Arlington County, VA GO Bonds",,Government Bond,15001,50000,0,Y,,
"",Rose Rock Midstream,Oil & Gas,,1001,15000,0,Y,,
"",Event Driven Managers II Fund,,Mutual Fund,1001,15000,0,Y,,
"",Dividends Earned But Not Yet Paid,,"""Account"" or Combination of other types (I.e.Stocks & Bonds)",1001,15000,0,Y,,
"",Cash,,Cash/Money Market/Savings/Checking,1001,15000,0,Y,,
"","15% interest in Legal Press, LLC",,Cash/Money Market/Savings/Checking,1001,15000,0,Y,,
"",interest in Trott Northwestern,Unknown,,1,1000,0,Y,,
"",10% interest in Trott-ATA LLC,,Cash/Money Market/Savings/Checking,1,1000,0,Y,,
