orgid,orgname,industry,asset_type,min,max,hidemax,type,lobbies,contributes
D000034429,Hensley & Co,"Beer, Wine & Liquor",,2000002,2000002,1,Y,,Y
"",Dream Catcher Family/Resid Real Estate,Real Estate,,2000002,2000002,1,Y,,
"",JPMorgan Tax Free Money Market,Unknown,Cash/Money Market/Savings/Checking,616004,1317000,0,Y,,
"",Unimproved Land Adjacent to Residential,Real Estate,,600002,1250000,0,Y,,
"",American Funds World Growth/Income Fund,Unknown,Mutual Fund,500001,1001000,0,Y,,
"",Sedona Property/Residence & Guest Homes,Real Estate,,1000001,1000001,1,Y,,
"","Residential Property/La Jolla, CA",Real Estate,,1000001,1000001,1,Y,,
"",King Aviation,Air Transport,,1000001,1000001,1,Y,,
"",Wild River LLC/Real Estate,Real Estate,,500002,1000000,0,Y,,
"",Wild River LLC/Hensley & Co Note,Unknown,,500001,1000000,0,Y,,
"",Sedona Hidden Valley Guest House & Land,Real Estate,,500001,1000000,0,Y,,
"",Fielder's Choice LLC,Recreation,,500001,1000000,0,Y,,
"",American Funds Tax Exempt Bond Fund,Unknown,Mutual Fund,500001,1000000,0,Y,,
"",American Funds American Mutual Fund,Unknown,Mutual Fund,500001,1000000,0,Y,,
"",701/801 LLC,Real Estate,,500001,1000000,0,Y,,
"",American Funds Washington Mutual Fund,Unknown,Mutual Fund,300002,601000,0,Y,,
"",American Funds Investment Co of America,Unknown,Mutual Fund,300002,601000,0,Y,,
"",American Funds New Perspective Fund,Unknown,Mutual Fund,200002,501000,0,Y,,
"",New York Life Whole Life Policy,Unknown,Insurance policies & Annuities,250001,500000,0,Y,,
"",American Funds Limited Term Tax Exempt,Unknown,Mutual Fund,250001,500000,0,Y,,
"",American Funds AMCAP Fund,Unknown,Mutual Fund,250001,500000,0,Y,,
"","Maricopa County, AZ Bond",Unknown,Government Bond,119007,310000,0,Y,,
"",Centennial Money Market Account,Unknown,Cash/Money Market/Savings/Checking,115002,300000,0,Y,,
"",American Funds Cash Management Trust,Unknown,Cash/Money Market/Savings/Checking,101002,266000,0,Y,,
"",JPMorgan Chase Bank/Checking & Savings,Unknown,Cash/Money Market/Savings/Checking,101002,265000,0,Y,,
"",SunLife Universal Life Policy,Unknown,Insurance policies & Annuities,100001,250000,0,Y,,
"",Bank Capital Corp,Commercial Banks,,100001,250000,0,Y,,
"",Wachovia Bank/Checking,Unknown,Cash/Money Market/Savings/Checking,65002,150000,0,Y,,
"",JPMorgan Arizona Municipal Bond Fund,Unknown,Mutual Fund,65002,150000,0,Y,,
"",JPMorgan Asia Equity Fund,Unknown,Mutual Fund,52003,130000,0,Y,,
"","Phoenix, AZ Revenue Bond",Unknown,Government Bond,51002,115000,0,Y,,
"",American Funds Fundamental Investors,Unknown,Mutual Fund,50001,101000,0,Y,,
"",Washington Motor Vehicle,Unknown,Government Bond,50001,100000,0,Y,,
"","St Clair County, IL Public Bond",Unknown,Government Bond,50001,100000,0,Y,,
"","Sedona Vacant Land/Cornville, AZ",Real Estate,,50001,100000,0,Y,,
"","Phoenix, AZ Bond",Unknown,Government Bond,50001,100000,0,Y,,
"",JPMorgan US Equity Fund,Unknown,Mutual Fund,50001,100000,0,Y,,
"",JPMorgan Tax Aware Disciplined Equity Fd,Unknown,Mutual Fund,50001,100000,0,Y,,
"",JPMorgan Short Duration Bond Fund,Unknown,Mutual Fund,50001,100000,0,Y,,
"",JPMorgan Municipal Income Bond Fund,Unknown,Mutual Fund,30002,100000,0,Y,,
"",JPMorgan Large Cap Growth Fund,Unknown,Mutual Fund,50001,100000,0,Y,,
"",JPMorgan International Value Fund,Unknown,Mutual Fund,50001,100000,0,Y,,
"",JPMorgan International Equity Index,Unknown,Mutual Fund,50001,100000,0,Y,,
"",JPMorgan Deposit Sweep Premier,Unknown,Cash/Money Market/Savings/Checking,50001,100000,0,Y,,
"",James Hensley Qualified GST Non-Exempt,Unknown,"Brokerage, IRA, 401k",50001,100000,0,Y,,
"",JPMorgan Intrepid Growth Fund,Unknown,Mutual Fund,17003,80000,0,Y,,
"",JPMorgan Intrepid America Fund,Unknown,Mutual Fund,17003,80000,0,Y,,
"",JPMorgan Highbridge Stat Mkt Neut Fund,Unknown,Mutual Fund,17003,80000,0,Y,,
"","Houston, TX Indep School District Bond",Unknown,Government Bond,17003,80000,0,Y,,
"",JPMorgan Intrepid International Fund,Unknown,Mutual Fund,16002,66000,0,Y,,
"","Keller, TX Indep School Dist Bond",Unknown,Government Bond,16002,65000,0,Y,,
"",JPMorgan Chase/Checking & Savings,Unknown,Cash/Money Market/Savings/Checking,16002,65000,0,Y,,
"",JPMorgan US Real Estate Fund,Real Estate,Mutual Fund,15001,51000,0,Y,,
"",Wild Creek Enterprises/JPMorgan Checking,Unknown,,15001,50000,0,Y,,
"",Washington State Bond,Unknown,Government Bond,15001,50000,0,Y,,
"",Utah Muni Fin Coop Bond,Unknown,Government Bond,15001,50000,0,Y,,
"",Texas Public Finance Auth Building Bond,Unknown,Government Bond,15001,50000,0,Y,,
"","Sussex County, NJ Muni Utils Bond",Unknown,Government Bond,15001,50000,0,Y,,
"",Springfield OH City School District Bond,Unknown,Government Bond,15001,50000,0,Y,,
D000042775,Sports Authority,Unknown,Government Bond,15001,50000,0,Y,,
"","San Antonio, TX Indep Sch Dist Rfdg Bond",Unknown,Government Bond,15001,50000,0,Y,,
"",Palm Beach Cnty FL Solid Waste Auth Bond,Unknown,Government Bond,15001,50000,0,Y,,
"",Miscellaneous Home Furnishings,Unknown,"""Account"" or Combination of other types (I.e.Stocks & Bonds)",15001,50000,0,Y,,
"",Leon County FL Certificates of Particip,Unknown,Government Bond,15001,50000,0,Y,,
"",JPMorgan US Large Cap Core Plus Fund,Unknown,Mutual Fund,15001,50000,0,Y,,
"",JPMorgan US Government Money Market,Unknown,Cash/Money Market/Savings/Checking,15001,50000,0,Y,,
"",JPMorgan Multi Cap Market Neutral Fund,Unknown,Mutual Fund,15001,50000,0,Y,,
"",JPMorgan Diversified Mid Cap Growth Fund,Unknown,Mutual Fund,15001,50000,0,Y,,
"",JPMorgan Chase Bank/Savings,Unknown,Cash/Money Market/Savings/Checking,15001,50000,0,Y,,
"",JPMorgan Chase Bank/Checking,Unknown,Cash/Money Market/Savings/Checking,15001,50000,0,Y,,
"","Jackson, OH Local School District Bond",Unknown,Government Bond,15001,50000,0,Y,,
"",Illinois Dev Fin Auth Rev Loc Govt Bond,Unknown,Government Bond,15001,50000,0,Y,,
"","Desert Sands, CA USD Bonds",Unknown,Government Bond,15001,50000,0,Y,,
"","Camden County, NJ Muni Utils Bond",Unknown,Government Bond,15001,50000,0,Y,,
"",JPMorgan High Yield Bond Fund,Unknown,Mutual Fund,2002,31000,0,Y,,
"","Wylie, TX Independent School Dist Bond",Unknown,Government Bond,2002,30000,0,Y,,
"",Thornburg Value Fund,Unknown,Mutual Fund,2002,30000,0,Y,,
"",North Slope Boro Ak Bond,Unknown,Government Bond,2002,30000,0,Y,,
"",JPMorgan Tax Aware Real Return Fund,Unknown,Mutual Fund,2002,30000,0,Y,,
"",Harbor International Fund,Unknown,Mutual Fund,2002,30000,0,Y,,
"",Fidelity High Income Advantage Fund,Unknown,Mutual Fund,2002,30000,0,Y,,
"",E470 Public Highway Authority Bond,Unknown,Government Bond,2002,30000,0,Y,,
"",Vanguard Emerging Markets ETF,Unknown,Mutual Fund,1001,16000,0,Y,,
"",Third Avenue Value Fund,Unknown,Mutual Fund,1001,16000,0,Y,,
"",Manning & Napier Fund,Unknown,Mutual Fund,1001,16000,0,Y,,
"",FMI Large Cap Fund,Unknown,Mutual Fund,1001,16000,0,Y,,
"",Dodge & Cox International Stock Fund,Unknown,Mutual Fund,1001,16000,0,Y,,
"",Will Cnty IL Cmnty Cons School Dist Bond,Unknown,Government Bond,1001,15000,0,Y,,
"",Wild Rapids LLC/JPMorgan Checking,Unknown,,1001,15000,0,Y,,
"","Westmoreland County, Pa Muni Bond",Unknown,Government Bond,1001,15000,0,Y,,
"",West Virginia Infrastructure Bond,Unknown,Government Bond,1001,15000,0,Y,,
"",Washington State Motor Vehcle Bond,Unknown,Government Bond,1001,15000,0,Y,,
"",USAA Account,Unknown,Cash/Money Market/Savings/Checking,1001,15000,0,Y,,
D000000566,US Airways,Air Transport,,1001,15000,0,Y,,
"",Texas Municipal Power Agency Bond,Unknown,Government Bond,1001,15000,0,Y,,
D000029349,TCF Financial,Commercial Banks,,1001,15000,0,Y,,Y
"",Shares US Treasury Inflation Protectio,Unknown,Mutual Fund,1001,15000,0,Y,,
"",New Jersey Econ Dev Authrv Motor Vehicle,Unknown,Government Bond,1001,15000,0,Y,,
"",Navy Federal Credit Union/Checking,Unknown,Cash/Money Market/Savings/Checking,1001,15000,0,Y,,
"",Murrieta Vy CA Unified Sch Dist Bond,Unknown,Government Bond,1001,15000,0,Y,,
"",Miami-Dade County Bond,Unknown,Government Bond,1001,15000,0,Y,,
"","Merrillville, IN Multi Bond",Unknown,Government Bond,1001,15000,0,Y,,
"","Maricopa, Az Indus Devel Auth Single Fam",Unknown,Government Bond,1001,15000,0,Y,,
"",Marble Falls TX ISD Bond,Unknown,Government Bond,1001,15000,0,Y,,
"","Lubbock, TX Housing Fin Corp Bond",Unknown,Government Bond,1001,15000,0,Y,,
"",Lewisville TX Indep School District Bond,Unknown,Government Bond,1001,15000,0,Y,,
"","Labette Cnty, KS Single Family Mtg Bond",Unknown,Government Bond,1001,15000,0,Y,,
"",Kendall Kane & Will Counties Bond,Unknown,Government Bond,1001,15000,0,Y,,
"","Kansas City, KS Single Fam Mortgage Bond",Unknown,Government Bond,1001,15000,0,Y,,
"",JPMorgan Small Cap Value Fund,Unknown,Mutual Fund,1001,15000,0,Y,,
"",JPMorgan Small Cap Growth Fund,Unknown,Mutual Fund,1001,15000,0,Y,,
"",JPMorgan Growth Advantage Fund,Unknown,Mutual Fund,1001,15000,0,Y,,
"",JPMorgan Diversified Mid Cap Value Fund,Unknown,Mutual Fund,1001,15000,0,Y,,
"",iShares Russell Mid Cap Index,Unknown,Mutual Fund,1001,15000,0,Y,,
"","Indianapolis, IN Local Pub Impvt Bond",Unknown,Government Bond,1001,15000,0,Y,,
"",Illinois Zero Coupon Bond,Unknown,Government Bond,1001,15000,0,Y,,
"",Illinois Devel Fin Auth Rev School Dist,Unknown,Government Bond,1001,15000,0,Y,,
"",Illinois College Savings 0% Bonds,Unknown,Government Bond,1001,15000,0,Y,,
"",Hays TX Cons Independent Sch Dist Rfdg,Unknown,Government Bond,1001,15000,0,Y,,
"",Gahanna Jefferson City Sch Dist Bond,Unknown,Government Bond,1001,15000,0,Y,,
"","Elgin, TX Independent School Dist Bond",Unknown,Government Bond,1001,15000,0,Y,,
"","Du Page County, IL Bond",Unknown,Government Bond,1001,15000,0,Y,,
"",Dream Catcher Family LLC/JPMorgan Chkg,Unknown,,1001,15000,0,Y,,
"","Crowley, TX Indpt School Bond",Unknown,Government Bond,1001,15000,0,Y,,
"","Cook County, IL School District Bond",Unknown,Government Bond,1001,15000,0,Y,,
"","Cook County, IL Burbank Sch Dist Bond",Unknown,Government Bond,1001,15000,0,Y,,
"",Cook Cnty IL Cmnty Cons School Dist Bond,Unknown,Government Bond,1001,15000,0,Y,,
"","Clayton, MO School District Refunding",Unknown,Government Bond,1001,15000,0,Y,,
"",Arkansas State College Savings Bond,Unknown,Government Bond,1001,15000,0,Y,,
"",Apollo Investment Corp,Securities/Invest,,1001,15000,0,Y,,
"","Anaheim, CA Public Financing Auth Bond",Unknown,Government Bond,1001,15000,0,Y,,
"",Alaska Municipal Bond,Unknown,Government Bond,1001,15000,0,Y,,
"",Adams 12 Five Star Schs Bond,Unknown,Government Bond,1001,15000,0,Y,,
D000000144,Anheuser-Busch,"Beer, Wine & Liquor",,0,3000,0,Y,,
"",Lord Abbett Mid Cap Value Fund,Unknown,Mutual Fund,0,2000,0,Y,,
"",Estrella Medical Plaza LLC,Real Estate,,0,2000,0,Y,,
"",American Funds Growth Fund of America,Unknown,Mutual Fund,0,2000,0,Y,,
"",Wild River LLC Distribution,Unknown,,0,1000,0,Y,,
"",USAA/Checking & Savings,Unknown,Cash/Money Market/Savings/Checking,0,1000,0,Y,,
"",SPDR Gold Trust ETF,Mining,,0,1000,0,Y,,
"",Princess Medical Center,Hospitals/Nurs Homes,,0,1000,0,Y,,
"",Lord Abbett Affiliated Fund,Unknown,Mutual Fund,0,1000,0,Y,,
"",JPMorgan International Equity Fund,Unknown,Mutual Fund,0,1000,0,Y,,
"",iShares Russell 2000 Index,Unknown,Mutual Fund,0,1000,0,Y,,
"","Houston, TX Water & Sewer Bond",Unknown,Government Bond,0,1000,0,Y,,
D000034429,Hensley & Co/Land,Real Estate,,0,1000,0,Y,,Y
"",Grolsch License,Unknown,"""Account"" or Combination of other types (I.e.Stocks & Bonds)",0,1000,0,Y,,
"",Davis New York Venture Fund,Securities/Invest,Mutual Fund,0,1000,0,Y,,
"",CM Revocable Trust Merrill Lynch Tr,Unknown,"Brokerage, IRA, 401k",0,1000,0,Y,,
"","Chicago, IL Tax Increment Bond",Unknown,Government Bond,0,1000,0,Y,,
"",American Funds Small Cap World Fund,Unknown,Mutual Fund,0,1000,0,Y,,
"",American Funds Income Fund of America,Unknown,Mutual Fund,0,1000,0,Y,,
"",American Funds Europacific Growth Fund,Unknown,Mutual Fund,0,1000,0,Y,,
"",American Funds EuroPacific Fund,Unknown,Mutual Fund,0,1000,0,Y,,
