orgid,orgname,industry,asset_type,min,max,hidemax,type,lobbies,contributes
"",US Senate Federal Credit Union,Unknown,Cash/Money Market/Savings/Checking,115002,300000,0,Y,,
"","Cottage/County Galway, Ireland",Real Estate,,100001,250000,0,A,,
"",Legg Mason IRA Money Market,Unknown,Cash/Money Market/Savings/Checking,16002,65000,0,Y,,
"","Timberlakes Community Lot/Wasatch, UT",Real Estate,,15001,50000,0,A,,
"",Legg Mason Value Trust Fund,Unknown,Mutual Fund,15001,50000,0,Y,,
"",Legg Mason Focus Trust,Unknown,Mutual Fund,15001,50000,0,Y,,
D000022524,Blockbuster Inc,Misc Services,,15001,50000,0,Y,,
D000042939,Altiris Inc,Unknown,,15001,50000,0,Y,,
"",GC Entrepreneurs Fund II LP,Unknown,,0,1000,0,A,,
