orgid,orgname,industry,asset_type,min,max,hidemax,type,lobbies,contributes
"",Trust A JE Wilkinson Inherited & not sel,Unknown,"Brokerage, IRA, 401k",1000001,5000000,0,Y,,
"",Touch the Earth Ranch,Livestock,,1000001,5000000,0,Y,,
"",Trust Edna M Wilkinson Inherited,Unknown,"Brokerage, IRA, 401k",500001,1000000,0,Y,,
"","House/E Capitol St/Washington, DC",Real Estate,,500001,1000000,0,Y,,
"",7344 Gwin St/Valley Spring CA,Real Estate,,250001,500000,0,Y,,
"",Health Fusion,Misc Health,,15001,50000,0,Y,,
"",American Funds Fundamental Investors Fd,Unknown,Mutual Fund,15001,50000,0,Y,,
"",American Funds Small Cap World Fund,Unknown,Mutual Fund,1001,15000,0,Y,,
"",American Funds New Economy Fund,Unknown,Mutual Fund,1001,15000,0,Y,,
