orgid,orgname,industry,asset_type,min,max,hidemax,type,lobbies,contributes
"",Washington Dept of Retirement Systems,Unknown,"Brokerage, IRA, 401k",115002,300000,0,A,,
"",T Rowe Price Personal Strategy Growth,Unknown,Mutual Fund,15001,50000,0,A,,
"",T Rowe Price Mid Cap Growth Fund,Unknown,Mutual Fund,15001,50000,0,A,,
"",T Rowe Price Equity Income Fund,Unknown,Mutual Fund,15001,50000,0,A,,
"",PIMCO Total Return Fund,Unknown,Mutual Fund,15001,50000,0,A,,
D000034717,International Creative Management,TV/Movies/Music,,15001,50000,0,A,,
"",Prevail Credit Union,Unknown,Cash/Money Market/Savings/Checking,1001,15000,0,A,,
"",Federal Credit Union,Credit Unions,Cash/Money Market/Savings/Checking,1001,15000,0,A,,
"",Bank of America account,Commercial Banks,Cash/Money Market/Savings/Checking,1001,15000,0,A,,
