orgid,orgname,industry,asset_type,min,max,hidemax,type,lobbies,contributes
"",Allied Funeral Assoc,Misc Services,,280003,600000,0,Y,,
"",Mississippi Public Employees Retirement,Unknown,"Brokerage, IRA, 401k",65002,150000,0,Y,,
"",Mississippi Supplemental Legislative Ret,Unknown,"Brokerage, IRA, 401k",15001,50000,0,Y,,
"",Fidelity Diversified held in,Unknown,,1001,15000,0,Y,,
"",Fayez Saraform,Unknown,,1001,15000,0,Y,,
"",Boston Co Mid-Cap held in,Unknown,,1001,15000,0,Y,,
"",Blackrock Equity Fund held in,Unknown,,1001,15000,0,Y,,
"",BancorpSouth/checking account,Unknown,,1001,15000,0,Y,,
