orgid,orgname,industry,asset_type,min,max,hidemax,type,lobbies,contributes
"",General Board/Ministerial Pension Plan,Unknown,"Brokerage, IRA, 401k",150002,350000,0,Y,,
"",Grandview Auto Wash,Misc Services,,100001,250000,0,Y,,
"",Allianz Life Powerdex Elite Annuity,Unknown,Insurance policies & Annuities,100001,250000,0,Y,,
"",General Board/Personal Investment Plan,Unknown,"Brokerage, IRA, 401k",15001,50000,0,Y,,
"",Allianz Life Insurance Simple Retirement,Unknown,"Brokerage, IRA, 401k",1001,15000,0,Y,,
