orgid,orgname,industry,asset_type,min,max,hidemax,type,lobbies,contributes
"","Home with Rental Unit in Washington, DC",,,1000001,5000000,0,Y,,
"",Vanguard TIPS Fund,,Mutual Fund,200002,500000,0,Y,,
"",US Savings Bond,,Government Bond,250001,500000,0,Y,,
"",Wescom Credit Union account,,Cash/Money Market/Savings/Checking,103004,295000,0,Y,,
"",California Legislators Retirement Pension,,"Brokerage, IRA, 401k",100001,250000,0,Y,,
"",Union Bank of California,Commercial Banks,,15001,50000,0,Y,,
"",Congressional Federal Credit Union,Credit Unions,Cash/Money Market/Savings/Checking,15001,50000,0,Y,,
"",Bee Bee Draw/Hambert Properties,Unknown,,15001,50000,0,Y,,
"",Value of CPA Practice Equipment,,,1,1000,0,Y,,
