orgid,orgname,industry,asset_type,min,max,hidemax,type,lobbies,contributes
"",Public Employees Retirement System,Civil Servants,"Brokerage, IRA, 401k",250001,500000,0,N,,
"",Cuyahoga County Deffered Compensation,Unknown,"Brokerage, IRA, 401k",100001,250000,0,N,,
"",Third Federal/Checking,Unknown,Cash/Money Market/Savings/Checking,15001,50000,0,N,,
"",Pacific Life Deffered Compensation,Unknown,"Brokerage, IRA, 401k",15001,50000,0,N,,
"",Telephone Credit Union IRA,Unknown,"Brokerage, IRA, 401k",1001,15000,0,N,,
