orgid,orgname,industry,asset_type,min,max,hidemax,type,lobbies,contributes
"",Federal Retirement Account,Unknown,"Brokerage, IRA, 401k",250001,500000,0,Y,,
"",US Senate Federal Credit Union,Unknown,Cash/Money Market/Savings/Checking,50001,100000,0,Y,,
"",US Senate Federal Credit Union IRA,Unknown,Cash/Money Market/Savings/Checking,15001,50000,0,Y,,
"",Retirement Account,Unknown,"Brokerage, IRA, 401k",15001,50000,0,Y,,
"",Capitol Hill Investment Club,Unknown,"""Account"" or Combination of other types (I.e.Stocks & Bonds)",1001,15000,0,Y,,
