orgid,orgname,industry,asset_type,min,max,hidemax,type,lobbies,contributes
"",Tweedy Browne Value Fund,Unknown,Mutual Fund,15001,50000,0,Y,,
"",Tweedy Browne Global Fund,Unknown,Mutual Fund,15001,50000,0,Y,,
"",Fidelity Diversified International Fund,Unknown,Mutual Fund,15001,50000,0,Y,,
"",Allianz NFJ Small Cap Value Fund,Unknown,Mutual Fund,15001,50000,0,Y,,
"",SunAmerica Blue Chip Growth Fund,Unknown,Mutual Fund,1003,17000,0,Y,,
"",Spartan US Equity Index,Unknown,Mutual Fund,1001,15000,0,Y,,
D000022465,Lincoln Financial Group,Misc Finance,Cash/Money Market/Savings/Checking,1001,15000,0,Y,,Y
"",Fidelity Blue Chip Growth Fund,Unknown,Mutual Fund,1001,15000,0,Y,,
