orgid,orgname,industry,asset_type,min,max,hidemax,type,lobbies,contributes
"",HHS Enterprises,Real Estate,,1000001,1000001,1,N,,
"",Ancestral Family Ranch Land,Livestock,,250001,500000,0,N,,
"",New York Life Whole Life Insurance,Unknown,Insurance policies & Annuities,15001,50000,0,N,,
"",Wells Fargo Bank West/cash,Unknown,Cash/Money Market/Savings/Checking,1001,15000,0,N,,
"",Knights of Columbus-Life Insurance,Unknown,Insurance policies & Annuities,1001,15000,0,N,,
"",Colorado State Employees Credit Union,Unknown,Cash/Money Market/Savings/Checking,1001,15000,0,N,,
"",Chevy Chase Bank/cash,Unknown,Cash/Money Market/Savings/Checking,1001,15000,0,N,,
