orgid,orgname,industry,asset_type,min,max,hidemax,type,lobbies,contributes
"",American Funds Growth Fund of America,Unknown,Mutual Fund,100001,250000,0,Y,,
"",Cref,Unknown,,50001,100000,0,Y,,
"",American New Perspective Fund,Unknown,Mutual Fund,50001,100000,0,Y,,
"",American Funds Income Fund of America,Unknown,Mutual Fund,50001,100000,0,Y,,
"",American Capital World Growth & Income,Unknown,Mutual Fund,50001,100000,0,Y,,
"",TIAA Traditional Account,Unknown,Mutual Fund,15001,50000,0,Y,,
"",American Washington Mutual Investors,Unknown,,15001,50000,0,Y,,
"",American Capital Income Builder Fund,Unknown,Mutual Fund,15001,50000,0,Y,,
"",National Penn Bank,Commercial Banks,Cash/Money Market/Savings/Checking,1001,15000,0,Y,,
