orgid,orgname,industry,asset_type,min,max,hidemax,type,lobbies,contributes
"",TSP Great Securities Investment Fund,Unknown,Mutual Fund,100001,250000,0,Y,,
"",CREF Stock (U428372-9),Unknown,Mutual Fund,100001,250000,0,Y,,
"",TIAA Traditional (C428372-1),Unknown,"Brokerage, IRA, 401k",50001,100000,0,Y,,
"",PERA Defined Benefit Plan,Unknown,"Brokerage, IRA, 401k",50001,100000,0,A,,
"",PER Advantage US Large Cap Stock Fund,Unknown,Mutual Fund,50001,100000,0,Y,,
"",Invesco Charter Fund,Unknown,Mutual Fund,1001,15000,0,Y,,
"",Franklin Mutual Beacon Fund,Unknown,Mutual Fund,1001,15000,0,Y,,
"",American Funds Capital World Growth & Income Fund,Unknown,Mutual Fund,1001,15000,0,Y,,
